205522,A,openGL SubTexturing I have image data and i want to get a sub image of that to use as an opengl texture. glGenTextures(1 &m_name); glGetIntegerv(GL_TEXTURE_BINDING_2D &oldName); glBindTexture(GL_TEXTURE_2D m_name); glTexParameteri(GL_TEXTURE_2D GL_TEXTURE_MIN_FILTER GL_LINEAR); glTexParameteri(GL_TEXTURE_2D GL_TEXTURE_MAG_FILTER GL_LINEAR); glTexImage2D(GL_TEXTURE_2D 0 GL_RGBA m_width m_height 0 GL_RGBA GL_UNSIGNED_BYTE m_data); How can i get a sub image of that image loaded as a texture. I think it has something to do with using glTexSubImage2D but i have no clue how to use it to create a new texture that i can load. Calling: glTexSubImage2D(GL_TEXTURE_2D 0 xOffset yOffset xWidth yHeight GL_RGBA GL_UNSIGNED_BYTE m_data); doe nothing that i can see and calling glCopyTexSubImage2D just takes part of my framebuffer. Thanks Edit: Use glPixelStorei. You use it to set GL_UNPACK_ROW_LENGTH to the width (in pixels) of the entire image. Then you call glTexImage2D (or whatever) passing it a pointer to the first pixel of the subimage and the width and height of the subimage. Don't forget to restore GL_UNPACK_ROW_LENGTH to 0 when you're finished with it. Ie: glPixelStorei( GL_UNPACK_ROW_LENGTH img_width ); char *subimg = (char*)m_data + (sub_x + sub_y*img_width)*4; glTexImage2D( GL_TEXTURE_2D 0 GL_RGBA sub_width sub_height 0 GL_RGBA GL_UNSIGNED_BYTE subimg ); glPixelStorei( GL_UNPACK_ROW_LENGTH 0 ); Or if you're allergic to pointer maths: glPixelStorei( GL_UNPACK_ROW_LENGTH img_width ); glPixelStorei( GL_UNPACK_SKIP_PIXELS sub_x ); glPixelStorei( GL_UNPACK_SKIP_ROWS sub_y ); glTexImage2D( GL_TEXTURE_2D 0 GL_RGBA sub_width sub_height 0 GL_RGBA GL_UNSIGNED_BYTE m_data ); glPixelStorei( GL_UNPACK_ROW_LENGTH 0 ); glPixelStorei( GL_UNPACK_SKIP_PIXELS 0 ); glPixelStorei( GL_UNPACK_SKIP_ROWS 0 ); Edit2: For the sake of completeness I should point out that if you're using OpenGL-ES then you don't get GL_UNPACK_ROW_LENGTH. In which case you could either (a) extract the subimage into a new buffer yourself or (b)... glTexImage2D( GL_TEXTURE_2D 0 GL_RGBA sub_width sub_height 0 GL_RGBA GL_UNSIGNED_BYTES NULL ); for( int y = 0; y < sub_height; y++ ) { char *row = m_data + ((y + sub_y)*img_width + sub_x) * 4; glTexSubImage2D( GL_TEXTURE_2D 0 0 y sub_width 1 GL_RGBA GL_UNSIGNED_BYTE row ); } Basically i have an image ( as raw data ) and i want to use part of that image as a texture. I know how to load the entire image as a texture but don't know how to use just a bit of it. Poster answered this. If you have an image in memory it is stored somehow. If you used glTexImage2D(...GL_RGBA GL_UNSIGNED_BYTE) to load then there's a byte for R G B and alpha value. The images are stored with pixel (0 0) starts at position 0. Pixel x at row y starts at image[width*y+x][0] since i am using openGL ES i ended up doing the first option u gave that is extracting subimage into a new buffer. sadly on the device it no longer works so i'm going to rework the texture so that i don't need to solve the problem.,c++ opengl1993431,A,"OpenGL: Rendering more than 8 lights how? How should I implement more than 8 lights in OpenGL? I would like to render unlimited amounts of lights efficiently. So whats the preferred method for doing this? OpenGL lights is a simplistic system that as far as I know is already in the deprecated list. You should handle lights yourself by writing a shader. Take a look here. the tutorial says ""therefore the best approach is to compile different shaders for different numbers of lights."" umm... thats not really what i want to do since i can move in the world and sometimes there might be 100 lights rendered sometimes 10 lights... i wouldnt want to write up to 2000 shaders for every possible combination of visible lights. Or did i understand something horribly wrong :/  Deferred shading. In a nutshell you render your scene without any lights. Instead you store the normals and world positions along with the textured pixels into multiple frame-buffers (so called render targets). You can even do this in a single pass if you use a multiple render-target extension. Once you have your buffers prepared you start to render a bunch of full-screen quads each with a pixel shader program that reads out the normals and positions and computes the light for one or multiple light-sources. Since light is additive you can render as much full-screen quads as you want and accumulate the light for as much light-sources as you want. A final step does a composition between your light and the unlit textured frame-buffer. That's more or less the state-of-the-art way to do it. Getting fog and transparency working with such a system is a challenge though.",c++ opengl lights765629,A,"Learning OpenGL through Java I'm interested in learning OpenGL and my favorite language at the time is Java. Can I reap its full (or most) benefits using things like JOGL or should I instead focus on getting stronger C++ skills? Btw which is your Java OpenGL wrapper library of choice and why? if you really want to get serious at 3d programming you have to learn C/C++ C++ is the standard for programming 3d games Games aren't the only commercial application of 3d graphics there's plenty of other things kitchen design software for example?  I have done some basic OpenGL development in Delphi and Java as well. I used JOGL as mentioned in others' replies and I must conclude that although there is very little difference in programming OpenGL in Java using JOGL and programming OpenGL in other languages (Delphi C++ etc...) it just doesn't feel right. It was driving me crazy to set it all up correctly and then writing stuff like gl.glBegin (GL.GL_QUADS) there seems to be a lot of superfuous gl GL GLU to be written and it just gets in your way. Also the performance would be I believe much better if you used C++ or similar NOT Java. I am not saying hands off JOGL (Java+OpenGL) it can be done and it really isn't too different but... as I said. Give c++ a try if you can. imho gl GL GLU is not superfluous since they allow to direct translate in Java their C code or tutorial I mean I prefer calling glBegin(GL_QUADS) instead of gl.glBegin(GL.GL_QUADS) :) then use ""import static"" :-) I partially agree. The ""gl"" prefix on the method names is not necessary.  JOGL is a wrapper library that allows OpenGL to be used in the Java programming language. It is currently the reference implementation for JSR-231 (Java Bindings for OpenGL) so it should be your first choice  Do it in C++ the bits you'll be using will basically be the same because there won't be much messing about with pointers so it's not a major leap of intuition. Also the C++ bindings are more reliable and (in my experience) the fastest out of all the langauges available (Python in particular REALLY can't do OpenGL). Also C++ is always a good thing to learn it makes you think about programming concepts in much more detail as opposed to just popping in an ArrayList<> or whatever pre-built class kind-of-serves your purposes =]  If you are also interested in just doing 3D stuff in Java without worrying about all that low-level stuff check out Java3D. Worst case you can look at how they leverage OpenGL for some good learning material.",java c++ opengl618829,A,openGL glDrawElements with interleaved buffers Thus far i have only used glDrawArrays and would like to move over to using an index buffer and indexed triangles. I am drawing a somewhat complicated object with texture coords normals and vertex coords. All this data is gathered into a single interleaved vertex buffer and drawn using calls similar to ( Assuming all the serup is done correctly ): glVertexPointer( 3 GL_FLOAT 22 (char*)m_vertexData ); glNormalPointer( GL_SHORT 22 (char*)m_vertexData+(12) ); glTexCoordPointer( 2 GL_SHORT 22 (char*)m_vertexData+(18) ); glDrawElements(GL_TRIANGLES m_numTriangles GL_UNSIGNED_SHORT m_indexData ); Does this allow for m_indexData to also be interleaved with the indices of my normals and texture coords as well as the standard position index array? Or does it assume a single linear list of inidices that apply to the entire vertex format ( POS NOR TEX )? If the latter is true how is it possible to render the same vertex with different texture coords or normals? I guess this question could also be rephrased into: if i had 3 seperate indexed lists ( POS NOR TEX ) where the latter 2 cannot be rearranged to share the same index list as the first what is the best way to render that. You cannot have different indexes for the different lists. When you specify glArrayElement(3) then OpenGL is going to take the 3rd element of every list. What you can do is play with the pointer you specify since essentially the place in the list which is eventually accessed is the pointer offset from the start of the list plus the index you specify. This is useful if you have a constant offset between the lists. if the lists are just a random permutation then this kind of play for every vertex is probably going to be as costy as just using plain old glVertex3fv() glNormal3fv() and glTexCoord3fv() Just to confirm the indices used in glDrawElements apply to your entire vertex format every time a vertex occurs on that mesh it must have the same normal and texture coords? i ask because certain 3D apps export models where a given vertex position might have different normal & texture coords If you want the same vertex to appear in a mesh with two different sets normals and texture coords then you'll need to add the vertex twice to arrays. As far as OpenGL is concerned they are two different vertices.  I am having similar trouble attempting to do the same in Direct3D 9.0 For my OpenGL 3 implementation it was rather easy and my source code is available online if it might help you any... https://github.com/RobertBColton/enigma-dev/blob/master/ENIGMAsystem/SHELL/Graphics_Systems/OpenGL3/GL3model.cpp,c++ opengl vertex-buffer1815513,A,"Problem with a volumetric fog in OpenGL Good day. I am trying to make a volumetric fog in OpenGL using glFogCoordfEXT. Why does a fog affect to all object of my scene even if they're not in fog's volume? And these objects become evenly gray as a fog itself. Here is a pic Code: void CFog::init() { glEnable(GL_FOG); glFogi(GL_FOG_MODE GL_LINEAR); glFogfv(GL_FOG_COLOR this->color); glFogf(GL_FOG_START 0.0f); glFogf(GL_FOG_END 1.0f); glHint(GL_FOG_HINT GL_NICEST); glFogi(GL_FOG_COORDINATE_SOURCE_EXT GL_FOG_COORDINATE_EXT); } void CFog::draw() { glBlendFunc(GL_SRC_ALPHA GL_SRC_ALPHA); glEnable(GL_BLEND); glPushMatrix(); glTranslatef(this->coords[0] this->coords[1] this->coords[2]); if(this->angle[0] != 0.0f) glRotatef(this->angle[0] 1.0f 0.0f 0.0f); if(this->angle[1] != 0.0f) glRotatef(this->angle[1] 0.0f 1.0f 0.0f); if(this->angle[2] != 0.0f) glRotatef(this->angle[2] 0.0f 0.0f 1.0f); glScalef(this->size this->size this->size); GLfloat one = 1.0f; GLfloat zero = 0.0f; glColor4f(0.0 0.0 0.0 0.5); glBegin(GL_QUADS); // Back Wall glFogCoordfEXT( one); glVertex3f(-2.5f-2.5f-15.0f); glFogCoordfEXT( one); glVertex3f( 2.5f-2.5f-15.0f); glFogCoordfEXT( one); glVertex3f( 2.5f 2.5f-15.0f); glFogCoordfEXT( one); glVertex3f(-2.5f 2.5f-15.0f); glEnd(); GLenum err; if((err = glGetError()) != GL_NO_ERROR) { char * str = (char *)glGetString(err); } glBegin(GL_QUADS); // Floor glFogCoordfEXT( one); glVertex3f(-2.5f-2.5f-15.0f); glFogCoordfEXT( one); glVertex3f( 2.5f-2.5f-15.0f); glFogCoordfEXT( zero); glVertex3f( 2.5f-2.5f 15.0f); glFogCoordfEXT( zero); glVertex3f(-2.5f-2.5f 15.0f); glEnd(); glBegin(GL_QUADS); // Roof glFogCoordfEXT( one); glVertex3f(-2.5f 2.5f-15.0f); glFogCoordfEXT( one); glVertex3f( 2.5f 2.5f-15.0f); glFogCoordfEXT( zero); glVertex3f( 2.5f 2.5f 15.0f); glFogCoordfEXT( zero); glVertex3f(-2.5f 2.5f 15.0f); glEnd(); glBegin(GL_QUADS); // Right Wall glFogCoordfEXT( zero); glVertex3f( 2.5f-2.5f 15.0f); glFogCoordfEXT( zero); glVertex3f( 2.5f 2.5f 15.0f); glFogCoordfEXT( one); glVertex3f( 2.5f 2.5f-15.0f); glFogCoordfEXT( one); glVertex3f( 2.5f-2.5f-15.0f); glEnd(); glBegin(GL_QUADS); // Left Wall glFogCoordfEXT( zero); glVertex3f(-2.5f-2.5f 15.0f); glFogCoordfEXT( zero); glVertex3f(-2.5f 2.5f 15.0f); glFogCoordfEXT( one); glVertex3f(-2.5f 2.5f-15.0f); glFogCoordfEXT( one); glVertex3f(-2.5f-2.5f-15.0f); glEnd(); glPopMatrix(); glDisable(GL_BLEND); //glDisable(GL_FOG); } Maybe there's no lighting in the scene? If all light sources are disabled all objects are going to appear in a flat ambient color. Check to see what happens if you disable fog altogether. Does this still happen? No lighting is there if I comment fog draw and init in my scene render functon all is fine  You seem to not be clear on how GL_fog_coord_EXT works. You're saying that an object is ""outside the fog volume"" but OpenGL does not have any notion of a fog volume. At any point either Fog is completely off or it's on in which case the fog equation will be applied with a fog coefficient that depends both on the fog mode (LINEAR in your case) and the fog coordinate. Regarding the fog coordinate. when using  glFogi(GL_FOG_COORDINATE_SOURCE_EXT GL_FOG_COORDINATE_EXT); You're telling OpenGL that every time you'll provide a vertex you'll also provide which fog coordinate to use through glFogCoordfEXT So what does it mean in your case ? Assuming you're not calling glFogCoordfEXT in your teapot drawing code you'll end up with the value of your last call to glFogCoordfEXT which looks like a glFogCoordf(one). So everything drawn in that case will be fully in fog which is what you observe. Now I'm not sure exactly what you're trying to achieve so I don't know how to help you solve the issue exactly. However if the goal is to use your quads to mimic fog simply turn fog off when drawing the scene and turn it on only when drawing the cube (I'm pretty sure it won't look like nice fog though). Thank you Bahbar!! this: ""you'll end up with the value of your last call to glFogCoordfEXT which looks like a glFogCoordf(one). "" helped! I just changed a drawing order and everything became ok:))",c++ opengl graphics648619,A,"Resizing an OpenGL window causes it to fall apart For some reason when I resize my OpenGL windows everything falls apart. The image is distorted the coordinates don't work and everything simply falls apart. I am sing Glut to set it up. //Code to setup glut glutInitWindowSize(appWidth appHeight); glutInitDisplayMode(GLUT_DOUBLE | GLUT_RGBA); glutCreateWindow(""Test Window""); //In drawing function glMatrixMode(GL_MODELVIEW); glLoadIdentity(); glClear(GL_COLOR_BUFFER_BIT); //Resize function void resize(int w int h) { glMatrixMode(GL_PROJECTION); glLoadIdentity(); gluOrtho2D(0 w h 0); } The OpenGL application is strictly 2D. This is how it looks like initially: http://www.picgarage.net/images/Corre_53880_651.jpeg this is how it looks like after resizing: http://www.picgarage.net/images/wrong_53885_268.jpeg The images are no longer available. You should not forget to hook the GLUT 'reshape' event: glutReshapeFunc(resize); And reset your viewport: void resize(int w int h) { glViewport(0 0 width height); //NEW glMatrixMode(GL_PROJECTION); glLoadIdentity(); gluOrtho2D(0 w h 0); } A perspective projection would have to take the new aspect ratio into account: void resizeWindow(int width int height) { double asratio; if (height == 0) height = 1; //to avoid divide-by-zero asratio = width / (double) height; glViewport(0 0 width height); //adjust GL viewport glMatrixMode(GL_PROJECTION); glLoadIdentity(); gluPerspective(FOV asratio ZMIN ZMAX); //adjust perspective glMatrixMode(GL_MODELVIEW); } And replace the C-style cast with static_cast<> since you're working with C++ :)",c++ opengl graphics glut1963157,A,OpenGL Video Memory Usage is there an API or profiler application that can track the video memory usage of my application? I am using C++/OpenGL on Windows but I am open to suggestions on other platforms as well. On Mac OS X you have OpenGL Profiler.app which comes with the Developer Tools (on the OS DVD or from http://developer.apple.com) On Windows you could try gDEBugger - a good commercial OpenGL Profiling tool.,c++ memory opengl profiling video-memory1302025,A,Game engine map editor. SDL->wxWidgets I have been writing an OpenGL game engine for a while which uses SDL for all the window management and for portability. I would like to create a level editor using the full engine. The engine itself isn't at all tied in with SDL except for input. I would like to use wxWidgets for the GUI and I have been looking at some OpenGL samples which are quite simple and easy to understand. Would it be simpler to try and integrate SDL with wxWidgets and use both or switch between them for use in different applications? What would be the best way to switch between the two systems? In all likelihood it would be easier to use one GUI API per application as opposed to merging the two together (i.e. easier to have SDL/OpenGL in your game and wxWidgets/OpenGL in your level editor). Usually these libraries are not built to be merged together or used in conjunction with other libraries so it would be nearly impossible to use them both in one program. For example I don't know much about SDL but a correctly-written wxWidgets program uses internal macros to generate int main() and start up its message pump among other things. If SDL required you to do the same thing (run some special initialization code in your int main() or allow SDL to generate its own int main()) you would be unable to initialize SDL properly without breaking wxWidgets and vice versa. Again I don't know if this particular conflict actually exists between the two libraries but it's just an example of how the two can interact and interfere with each other. That said in a perfect world it would be better to choose one of the libraries and use it both for your engine and level editor (i.e. use SDL/OpenGL for the engine and editor or wxWidgets/OpenGL for the engine and editor) but if you're happy maintaining two different API codebases then if it ain't broke don't fix it. SDL doesn't use a main() macro and can be initialized in parts but I'd guess that the message loops would overlap. (SDL requires you to implement your own loop.) Yeah if not at int main() then at the message loop will there be issues. wxWidgets creates its own native message loop completely hidden from the end-user; modifying it even slightly would easily break the library.,c++ opengl wxwidgets sdl279358,A,"Invalid lock sequence error in an OpenSceneGraph application I have an application that is built against OpenSceneGraph (2.6.1) and therefore indirectly OpenGL. The application initializes and begins to run but then I get the following exception ""attempt was made to execute an invalid lock sequence"" in OpenGL32.dll. When I re-run it I sometimes get this exception and sometimes an exception about a ""privileged instruction"". The call stack looks like it is corrupted so I can't really tell exactly where the exception is being thrown from. I ran the app quite a bit a couple of days ago and never saw this behavior. Since then I have added an else clause to a couple of ifs and that is all. My app is a console application is built with Visual Studio 2008 and it sets OpenScenGraph to SingleThreaded mode. Anybody seen this before? Any debugging tips? Can you reproduce it with one of the standard examples? Can you create a minimal app that causes this? Do you have a machine with a different brand video card you can test it on (eg Nvidia vs. ATI) there are some issues with openscenegraph and bad OpenGL drivers. Have you tried posting to osg-users@lists.openscenegraph.org  The problem turned out to be our app was picking up an incorrect version of the OpenGL DLL  instead of the one installed in System32.",c++ opengl openscenegraph1759397,A,"the quake 2 md2 file format (theory) i am trying to load md2 files in opengl but i noticed that most example programs just use a precompiled list of normals. something like this..... //table of precalculated normals { -0.525731f 0.000000f 0.850651f } { -0.442863f 0.238856f 0.864188f } { -0.295242f 0.000000f 0.955423f } { -0.309017f 0.500000f 0.809017f } ... ... Ok this may sound abit dumb but i thought each model is made of different triangles how then is it possible that you can use one set of precompiled normals to render all models? It seems abit strange and any ideas will be appreciated. You could use a precompiled table of normals and use a lookup table to select one that is 'good enough' for a particular case. Each triangle is on a distinct plane and it's that plane that has a normal not the triangle itself. For instance lets imagine we have a point. Expand that point into a sphere for the purposes of this discussion makes it a little easier to grasp conceptually. If you draw a perfect circle around that sphere on the y axis then rotate that circle in the x axis 1 degree each time you'll end up with 360 circles. If you take a normal at 1 degree intervals along each of those circles you'll end up with 360 ** 2 points. From there your normal is the vector from the center of the sphere to that point on the sphere and it is a normal for a plane constructed tangential to point on the sphere. What you end up with if you calculate these two for every point on that sphere is a precalculated table of normals which will almost certainly be good enough for most situations. Now you just need to design a lookup scheme for that data (plane -> normal). Do you happen to have any literature i can go through on this? No sorry this is just off the top of my head and my understanding of the math involved. Most higher level math books that cover 3d geometry should probably cover it though. +1. That's what I've heard. The table covers a finite subset of the unit sphere. So instead of storing normals in .md2 you would store indices to save space (That's what vector quantization is about).  It's been answered already but I want to shed some more light on it. The table contains vectors that cover the unit sphere's surface pretty uniformly. It seems the set of 162 vectors are the corners of a subdivided icosahedron. This is done to lossily compress 3D vectors of unit length to an index (8 bits) see vector quantization. For storing an arbitrary normal vector you can search the table for the closest match and store the index of this match instead. With this table of 162 well distributed vectors the angle between the original vector and the approximated one is expected to be below 11å¡ which seems to be good enough for the Quake2 engine.  The MD2 file format specifies that each vertex has a ""normal index"" and this is a lookup into a well-known table of normals. I would assume that these normals are distributed around a sphere. Presumably the tool that built the model chose the most appropriate of these normals for each vertex. With regard to the first answer: if you want a very faceted model (like a cube) then each polygon does indeed have its own normal and each of the vertices that makes up that polygon should use the same normal vector. However if you want smooth shading (such as a torso) it's common for each vertex in a polygon to have a different normal vector. This allows the lighting to vary across the polygon which is useful in both per-vertex and per-pixel lighting scenarios. Though you will use the polygon plane normal for lighting if you are drawing flat-shaded polygons. If you are talking about vertex normals then you still aren't talking about the polygon itself having a normal. You are still talking about a plane having a normal and that plane is usually taken to be a plane constructed perpendicular to the intended curvature of the shape at the point that the vertex occurs. I was just trying to clarify the point that I think you were making in your first paragraph. When it comes to MD2 models I think it's more useful to consider the tangent plane at each vertex rather than the tangent plane for each triangle (which is the way I read your answer at first). From your comment on my answer I think we're on the same page. I've done enough graphics work to be dangerous but not enough to know all that much. I just happen to be strong enough in the maths to figure out what's going on. The first paragraph was an attempt to answer the question as I percieved it was asked. As an aside the normals of the plane the polygon itself is on isn't useless it's just not used in lighting (it might be used ie in a physics engine though or collision detection or...).",c++ c opengl